{
  "achieved_level": "semantic",
  "artifact": {
    "format": "markdown",
    "media_type": "text/markdown",
    "path": ".sdlc/stories/ST-PORTABLE-WORKFLOW-HARDENING/outputs/implementation-evidence.md",
    "sha256": "f242a708005531ed2bc798277a4efed4dcc5ed91e8043c18f2c89ba4cc6f9234"
  },
  "artifact_present": true,
  "container_verified": {
    "checks": [
      "non-empty file (14514 bytes)",
      "extension .md",
      "non-binary text content"
    ],
    "evidence": [],
    "reason": null,
    "status": "verified",
    "verified_at": "2026-07-28T10:55:40.572Z",
    "verifier": "file-structure-v1"
  },
  "content_verified": {
    "checks": [
      "non-empty meaningful text content"
    ],
    "evidence": [],
    "reason": null,
    "status": "verified",
    "verified_at": "2026-07-28T10:55:40.572Z",
    "verifier": "file-structure-v1"
  },
  "evidence": [],
  "existence_verified": {
    "checks": [
      "non-empty file (14514 bytes)"
    ],
    "evidence": [],
    "reason": null,
    "status": "verified",
    "verified_at": "2026-07-28T10:55:40.572Z",
    "verifier": "file-existence-v1"
  },
  "extensions": {
    "delivery_label": "Markdown document",
    "delivery_mode": "artifact-plus-chat-summary",
    "size_bytes": 14514
  },
  "failed_checks": [],
  "generator_receipt": null,
  "hash_algorithm": "sha256:stable-json:v1",
  "id": "VERIFY-OUT-ST-PORTABLE-WORKFLOW-HARDENING-implementation-evidence-52f0f1e8-f242a708",
  "independent_verified": {
    "checks": [],
    "evidence": [],
    "reason": "Independent verification is outside the approved verification level.",
    "status": "not-required",
    "verified_at": null,
    "verifier": null
  },
  "kind": "verification_receipt",
  "limitations": [
    "Rendered and independent verification were not required by this output contract."
  ],
  "missing_checks": [],
  "passed": true,
  "receipt_hash": "48d86ef52d3f9e420dcb7562b35f484c7926b675ce6e6b3d983deb6fbba62640",
  "render_verified": {
    "checks": [],
    "evidence": [],
    "reason": "Approved format does not require rendered verification.",
    "status": "not-required",
    "verified_at": null,
    "verifier": "render-evidence-v1"
  },
  "required_dimensions": {
    "container": true,
    "content": true,
    "existence": true,
    "independent": false,
    "render": false
  },
  "required_level": "semantic",
  "schema_version": "verification-receipt:v1",
  "status": "passed",
  "subject_ref": {
    "hash": "6b845571ed36051fef3c1d84ae0813729a906a61706f6571b7634ceaead4394f",
    "id": "OUT-ST-PORTABLE-WORKFLOW-HARDENING-implementation-evidence-52f0f1e8",
    "kind": "output_link"
  },
  "verified_at": "2026-07-28T10:55:40.572Z",
  "verifier": "file-structure-v1",
  "version": 1
}
