{
  "achieved_level": "semantic",
  "artifact": {
    "format": "markdown",
    "media_type": "text/markdown",
    "path": ".sdlc/stories/ST-LOCAL-RUNTIME-HARDENING-R2/outputs/implementation-evidence.md",
    "sha256": "327215e2f3310dfd9c96877742580d983d0894728a4b2d769c8695ea10e59731"
  },
  "artifact_present": true,
  "container_verified": {
    "checks": [
      "non-empty file (4310 bytes)",
      "extension .md",
      "non-binary text content"
    ],
    "evidence": [],
    "reason": null,
    "status": "verified",
    "verified_at": "2026-07-29T22:35:06.654Z",
    "verifier": "file-structure-v1"
  },
  "content_verified": {
    "checks": [
      "non-empty meaningful text content"
    ],
    "evidence": [],
    "reason": null,
    "status": "verified",
    "verified_at": "2026-07-29T22:35:06.654Z",
    "verifier": "file-structure-v1"
  },
  "evidence": [],
  "existence_verified": {
    "checks": [
      "non-empty file (4310 bytes)"
    ],
    "evidence": [],
    "reason": null,
    "status": "verified",
    "verified_at": "2026-07-29T22:35:06.654Z",
    "verifier": "file-existence-v1"
  },
  "extensions": {
    "delivery_label": "Markdown document",
    "delivery_mode": "artifact-plus-chat-summary",
    "size_bytes": 4310
  },
  "failed_checks": [],
  "generator_receipt": null,
  "hash_algorithm": "sha256:stable-json:v1",
  "id": "VERIFY-OUT-ST-LOCAL-RUNTIME-HARDENING-R2-implementation-evidence-6ae045a1-327215e2",
  "independent_verified": {
    "checks": [],
    "evidence": [],
    "reason": "Independent verification is outside the approved verification level.",
    "status": "not-required",
    "verified_at": null,
    "verifier": null
  },
  "kind": "verification_receipt",
  "limitations": [
    "Rendered and independent verification were not required by this output contract."
  ],
  "missing_checks": [],
  "passed": true,
  "receipt_hash": "e1c7ee6a03331e483a72372dcbf88279c33fa87a5e3c5cc197d92bb63331ba20",
  "render_verified": {
    "checks": [],
    "evidence": [],
    "reason": "Approved format does not require rendered verification.",
    "status": "not-required",
    "verified_at": null,
    "verifier": "render-evidence-v1"
  },
  "required_dimensions": {
    "container": true,
    "content": true,
    "existence": true,
    "independent": false,
    "render": false
  },
  "required_level": "semantic",
  "schema_version": "verification-receipt:v1",
  "status": "passed",
  "subject_ref": {
    "hash": "6bdb4e2cf12d1822b74c221be52a12da813de3609cc1baa3e0ca92f6d8e6149a",
    "id": "OUT-ST-LOCAL-RUNTIME-HARDENING-R2-implementation-evidence-6ae045a1",
    "kind": "output_link"
  },
  "verified_at": "2026-07-29T22:35:06.654Z",
  "verifier": "file-structure-v1",
  "version": 1
}
