{
  "achieved_level": "semantic",
  "artifact": {
    "format": "markdown",
    "media_type": "text/markdown",
    "path": ".sdlc/stories/ST-OBSERVATORY-LINEAGE/outputs/implementation-evidence.md",
    "sha256": "3ca4dd084cdd41a5656ef2297672b2048e31b4c9ecfc0fefcde0de0e3dee0888"
  },
  "artifact_present": true,
  "container_verified": {
    "checks": [
      "non-empty file (11431 bytes)",
      "extension .md",
      "non-binary text content"
    ],
    "evidence": [],
    "reason": null,
    "status": "verified",
    "verified_at": "2026-07-17T08:22:24.333Z",
    "verifier": "file-structure-v1"
  },
  "content_verified": {
    "checks": [
      "non-empty meaningful text content"
    ],
    "evidence": [],
    "reason": null,
    "status": "verified",
    "verified_at": "2026-07-17T08:22:24.333Z",
    "verifier": "file-structure-v1"
  },
  "evidence": [
    {
      "kind": "render",
      "path": ".sdlc/tests/ST-OBSERVATORY-LINEAGE-desktop.png",
      "sha256": "5491049bbc7a8e994a068bc440778337b29eff1b2148cc010d8cda662a92c4d8"
    },
    {
      "kind": "render",
      "path": ".sdlc/tests/ST-OBSERVATORY-LINEAGE-mobile.png",
      "sha256": "4c309b55e1426b3900385cb77374a60e104666cc4680e579e10df94c46906ec0"
    }
  ],
  "existence_verified": {
    "checks": [
      "non-empty file (11431 bytes)"
    ],
    "evidence": [],
    "reason": null,
    "status": "verified",
    "verified_at": "2026-07-17T08:22:24.333Z",
    "verifier": "file-existence-v1"
  },
  "extensions": {
    "delivery_label": "Markdown document",
    "delivery_mode": "artifact-plus-chat-summary",
    "size_bytes": 11431
  },
  "failed_checks": [],
  "generator_receipt": null,
  "hash_algorithm": "sha256:stable-json:v1",
  "id": "VERIFY-OUT-ST-OBSERVATORY-LINEAGE-implementation-evidence-560904e9-3ca4dd08",
  "independent_verified": {
    "checks": [],
    "evidence": [],
    "reason": "Independent verification is outside the approved verification level.",
    "status": "not-required",
    "verified_at": null,
    "verifier": null
  },
  "kind": "verification_receipt",
  "limitations": [
    "Rendered and independent verification were not required by this output contract."
  ],
  "missing_checks": [],
  "passed": true,
  "receipt_hash": "45497daad66216bf4de13a608ec807fe710a42e9e29ee682ad35e845ec1f1766",
  "render_verified": {
    "checks": [],
    "evidence": [],
    "reason": "Approved format does not require rendered verification.",
    "status": "not-required",
    "verified_at": null,
    "verifier": "render-evidence-v1"
  },
  "required_dimensions": {
    "container": true,
    "content": true,
    "existence": true,
    "independent": false,
    "render": false
  },
  "required_level": "semantic",
  "schema_version": "verification-receipt:v1",
  "status": "passed",
  "subject_ref": {
    "hash": "468d46c9d8e2a9b728cffa306e52f44e9f15e35378ecd52bed27d7c78e1fbf6e",
    "id": "OUT-ST-OBSERVATORY-LINEAGE-implementation-evidence-560904e9",
    "kind": "output_link"
  },
  "verified_at": "2026-07-17T08:22:24.333Z",
  "verifier": "file-structure-v1",
  "version": 1
}
