{
  "achieved_level": "semantic",
  "artifact": {
    "format": "markdown",
    "media_type": "text/markdown",
    "path": ".sdlc/stories/ST-ENT-UX/outputs/implementation-evidence.md",
    "sha256": "61ca5a3c2dd285dc44044ccd94784414a2e72e58885a3f3cbbbe166d6dd93b75"
  },
  "artifact_present": true,
  "container_verified": {
    "checks": [
      "non-empty file (8557 bytes)",
      "extension .md",
      "non-binary text content"
    ],
    "evidence": [],
    "reason": null,
    "status": "verified",
    "verified_at": "2026-07-18T02:16:52.522Z",
    "verifier": "file-structure-v1"
  },
  "content_verified": {
    "checks": [
      "non-empty meaningful text content"
    ],
    "evidence": [],
    "reason": null,
    "status": "verified",
    "verified_at": "2026-07-18T02:16:52.522Z",
    "verifier": "file-structure-v1"
  },
  "evidence": [],
  "existence_verified": {
    "checks": [
      "non-empty file (8557 bytes)"
    ],
    "evidence": [],
    "reason": null,
    "status": "verified",
    "verified_at": "2026-07-18T02:16:52.522Z",
    "verifier": "file-existence-v1"
  },
  "extensions": {
    "delivery_label": "Markdown document",
    "delivery_mode": "artifact-plus-chat-summary",
    "size_bytes": 8557
  },
  "failed_checks": [],
  "generator_receipt": null,
  "hash_algorithm": "sha256:stable-json:v1",
  "id": "VERIFY-OUT-ST-ENT-UX-implementation-evidence-c520846b-61ca5a3c",
  "independent_verified": {
    "checks": [],
    "evidence": [],
    "reason": "Independent verification is outside the approved verification level.",
    "status": "not-required",
    "verified_at": null,
    "verifier": null
  },
  "kind": "verification_receipt",
  "limitations": [
    "Rendered and independent verification were not required by this output contract."
  ],
  "missing_checks": [],
  "passed": true,
  "receipt_hash": "dab52e0dda70f9d519bc54a33389d877fba896e782a79feed9e8052472f75bcb",
  "render_verified": {
    "checks": [],
    "evidence": [],
    "reason": "Approved format does not require rendered verification.",
    "status": "not-required",
    "verified_at": null,
    "verifier": "render-evidence-v1"
  },
  "required_dimensions": {
    "container": true,
    "content": true,
    "existence": true,
    "independent": false,
    "render": false
  },
  "required_level": "semantic",
  "schema_version": "verification-receipt:v1",
  "status": "passed",
  "subject_ref": {
    "hash": "98f7913f9c5df1bdec722092f7ec610a5a426561044ae1c40f91b814943353f4",
    "id": "OUT-ST-ENT-UX-implementation-evidence-c520846b",
    "kind": "output_link"
  },
  "verified_at": "2026-07-18T02:16:52.522Z",
  "verifier": "file-structure-v1",
  "version": 1
}
