{
  "achieved_level": "semantic",
  "artifact": {
    "format": "markdown",
    "media_type": "text/markdown",
    "path": ".sdlc/stories/ST-ENT-PORTFOLIO-R2/outputs/implementation-evidence.md",
    "sha256": "ca54b49593c620ec2d5ad40e643d8f4b3f82bae222db411287f36b701827358e"
  },
  "artifact_present": true,
  "container_verified": {
    "checks": [
      "non-empty file (5543 bytes)",
      "extension .md",
      "non-binary text content"
    ],
    "evidence": [],
    "reason": null,
    "status": "verified",
    "verified_at": "2026-07-19T01:40:03.164Z",
    "verifier": "file-structure-v1"
  },
  "content_verified": {
    "checks": [
      "non-empty meaningful text content"
    ],
    "evidence": [],
    "reason": null,
    "status": "verified",
    "verified_at": "2026-07-19T01:40:03.164Z",
    "verifier": "file-structure-v1"
  },
  "evidence": [],
  "existence_verified": {
    "checks": [
      "non-empty file (5543 bytes)"
    ],
    "evidence": [],
    "reason": null,
    "status": "verified",
    "verified_at": "2026-07-19T01:40:03.164Z",
    "verifier": "file-existence-v1"
  },
  "extensions": {
    "delivery_label": "Markdown document",
    "delivery_mode": "artifact-plus-chat-summary",
    "size_bytes": 5543
  },
  "failed_checks": [],
  "generator_receipt": null,
  "hash_algorithm": "sha256:stable-json:v1",
  "id": "VERIFY-OUT-ST-ENT-PORTFOLIO-R2-implementation-evidence-753c64a6-ca54b495",
  "independent_verified": {
    "checks": [],
    "evidence": [],
    "reason": "Independent verification is outside the approved verification level.",
    "status": "not-required",
    "verified_at": null,
    "verifier": null
  },
  "kind": "verification_receipt",
  "limitations": [
    "Rendered and independent verification were not required by this output contract."
  ],
  "missing_checks": [],
  "passed": true,
  "receipt_hash": "40f742effa92416dad577ad663de3666495632f0953062995378a64c682cb702",
  "render_verified": {
    "checks": [],
    "evidence": [],
    "reason": "Approved format does not require rendered verification.",
    "status": "not-required",
    "verified_at": null,
    "verifier": "render-evidence-v1"
  },
  "required_dimensions": {
    "container": true,
    "content": true,
    "existence": true,
    "independent": false,
    "render": false
  },
  "required_level": "semantic",
  "schema_version": "verification-receipt:v1",
  "status": "passed",
  "subject_ref": {
    "hash": "65eb6dcb928a84ca81b472c7010c628197d0265d1b68040b09709e278b66905a",
    "id": "OUT-ST-ENT-PORTFOLIO-R2-implementation-evidence-753c64a6",
    "kind": "output_link"
  },
  "verified_at": "2026-07-19T01:40:03.164Z",
  "verifier": "file-structure-v1",
  "version": 1
}
